{
  "id": "MDCG-2021-28",
  "title": {
    "en": "Substantial modification of clinical investigation under Medical Device Regulation",
    "he": "שינוי מהותי של חקירה קלינית על פי תקנת המכשירים הרפואיים"
  },
  "category": "Clinical Investigation and Evaluation",
  "publicationDate": "2021-12",
  "source": {
    "url": "https://health.ec.europa.eu/medical-devices-sector/new-regulations/guidance-mdcg-endorsed-documents-and-other-guidance_en",
    "file": "original/mdcg_2021-28_en.pdf"
  },
  "language": "he",
  "direction": "rtl",
  "translationStatus": "review",
  "glossaryVersion": "2026-06",
  "blocks": [
    {
      "id": "disclaimer-1",
      "type": "paragraph",
      "en": "This document has been endorsed by the Medical Device Coordination Group (MDCG) established by Article 103 of Regulation (EU) 2017/745. The MDCG is composed of representatives of all Member States and it is chaired by a representative of the European Commission.",
      "he": "מסמך זה אושר על ידי קבוצת תיאום המכשירים הרפואיים (MDCG) שהוקמה מכוח סעיף 103 לתקנה (האיחוד האירופי) 2017/745. ה-MDCG מורכבת מנציגים של כל המדינות החברות ובראשה עומד נציג של הנציבות האירופית."
    },
    {
      "id": "disclaimer-2",
      "type": "paragraph",
      "en": "The document is not a European Commission document and it cannot be regarded as reflecting the official position of the European Commission. Any views expressed in this document are not legally binding and only the Court of Justice of the European Union can give binding interpretations of Union law.",
      "he": "המסמך אינו מסמך של הנציבות האירופית ואין לראות בו כמשקף את העמדה הרשמית של הנציבות האירופית. כל דעה המובעת במסמך זה אינה מחייבת מבחינה משפטית, ורק בית הדין לצדק של האיחוד האירופי מוסמך לתת פרשנות מחייבת לדין האיחוד."
    },

    {
      "id": "sec-contents",
      "type": "heading",
      "level": 1,
      "en": "Contents",
      "he": "תוכן העניינים"
    },
    {
      "id": "contents-list",
      "type": "list",
      "ordered": false,
      "items": [
        { "en": "Acronyms", "he": "ראשי תיבות" },
        { "en": "Introduction", "he": "מבוא" },
        { "en": "Use of the template", "he": "שימוש בתבנית" },
        { "en": "Annex - Templates", "he": "נספח – תבניות" }
      ]
    },

    {
      "id": "sec-acronyms",
      "type": "heading",
      "level": 1,
      "en": "Acronyms",
      "he": "ראשי תיבות"
    },
    {
      "id": "acronyms-table",
      "type": "table",
      "header": true,
      "rows": [
        [
          { "en": "Acronym", "he": "ראשי תיבות" },
          { "en": "Meaning", "he": "משמעות" }
        ],
        [
          { "en": "EUDAMED", "he": "EUDAMED" },
          { "en": "European database on medical devices", "he": "מסד הנתונים האירופי בנושא מכשירים רפואיים" }
        ],
        [
          { "en": "GSPR", "he": "GSPR" },
          { "en": "General safety and performance requirements", "he": "דרישות כלליות לבטיחות וביצועים" }
        ],
        [
          { "en": "NCA", "he": "NCA" },
          { "en": "National Competent Authority", "he": "רשות מוסמכת לאומית" }
        ],
        [
          { "en": "PMCF", "he": "PMCF" },
          { "en": "Post-market clinical follow-up", "he": "מעקב קליני שלאחר שיווק" }
        ],
        [
          { "en": "REC", "he": "REC" },
          { "en": "Research ethics committee", "he": "ועדת אתיקה למחקר" }
        ]
      ]
    },

    {
      "id": "sec-intro",
      "type": "heading",
      "level": 1,
      "en": "Introduction",
      "he": "מבוא"
    },
    {
      "id": "intro-p1",
      "type": "paragraph",
      "en": "The sponsor of a clinical investigation is required to submit an application/notification to the Member State(s) in which a clinical investigation is to be conducted, accompanied by the documentation referred to in Chapter II of Annex XV of Regulation (EU) 2017/745 (MDR). The application/notification is required to be submitted by means of the electronic system referred to in Article 73 of the MDR. Additionally, the sponsor of a clinical investigation is required to notify the Member State(s) in which a clinical investigation is being or is to be conducted if it intends to introduce modifications to a clinical investigation that are likely to have a substantial impact on the safety, health or rights of the subjects or on the robustness or reliability of the clinical data generated by the investigation, within one week, by means of the same electronic system.",
      "he": "נותן החסות של חקירה קלינית נדרש להגיש בקשה/הודעה¹ למדינה/למדינות החברות שבהן עתידה להתבצע חקירה קלינית, בלוויית התיעוד המוזכר בפרק II של נספח XV לתקנה (האיחוד האירופי) 2017/745 (MDR)². הבקשה/ההודעה נדרשת להיות מוגשת באמצעות המערכת האלקטרונית המוזכרת בסעיף 73 ל-MDR. בנוסף, נותן החסות של חקירה קלינית נדרש להודיע³ למדינה/למדינות החברות שבהן מתבצעת או עתידה להתבצע חקירה קלינית, אם בכוונתו להכניס בחקירה הקלינית שינויים שצפויים להשפיע השפעה מהותית על הבטיחות, הבריאות או הזכויות של הנבדקים, או על האיתנות או המהימנות של הנתונים הקליניים המופקים מן החקירה, וזאת בתוך שבוע אחד ובאמצעות אותה מערכת אלקטרונית."
    },
    {
      "id": "fn-1",
      "type": "note",
      "marker": "1",
      "en": "Clinical investigation application (MDR Art. 62(1)), PMCF investigation notification (MDR Art. 74(1)), other clinical investigation application/notification, i.e. a national application (MDR Art. 82(1)).",
      "he": "בקשה לחקירה קלינית (MDR סעיף 62(1)), הודעה על חקירת PMCF (MDR סעיף 74(1)), בקשה/הודעה אחרת לחקירה קלינית, קרי בקשה לאומית (MDR סעיף 82(1))."
    },
    {
      "id": "fn-2",
      "type": "note",
      "marker": "2",
      "en": "Regulation (EU) 2017/745 of the European Parliament and of the Council of 5 April 2017 on medical devices, amending Directive 2001/83/EC, Regulation (EC) No 178/2002 and Regulation (EC) No 1223/2009 and repealing Council Directives 90/385/EEC and 93/42/EEC, OJ L 117, 5.5.2017, p. 1–175.",
      "he": "תקנה (האיחוד האירופי) 2017/745 של הפרלמנט האירופי ושל המועצה מ-5 באפריל 2017 בנושא מכשירים רפואיים, המתקנת את הוראה 2001/83/EC, תקנה (EC) מס' 178/2002 ותקנה (EC) מס' 1223/2009 ומבטלת את הוראות המועצה 90/385/EEC ו-93/42/EEC, OJ L 117, 5.5.2017, עמ' 1–175."
    },
    {
      "id": "fn-3",
      "type": "note",
      "marker": "3",
      "en": "Article 75 Regulation (EU) 2017/745",
      "he": "סעיף 75 לתקנה (האיחוד האירופי) 2017/745"
    },
    {
      "id": "intro-p2",
      "type": "paragraph",
      "en": "In the absence of the European database on medical devices (EUDAMED), a series of clinical investigation application/notification documents have been created to support clinical investigation procedures with respect to MDR – see MDCG 2021-8 and MDCG 2021-20.",
      "he": "בהיעדר מסד הנתונים האירופי בנושא מכשירים רפואיים (EUDAMED), נוצרה סדרה של מסמכי בקשה/הודעה לחקירה קלינית כדי לתמוך בהליכי חקירה קלינית ביחס ל-MDR – ראו MDCG 2021-8 ו-MDCG 2021-20."
    },
    {
      "id": "intro-p3",
      "type": "paragraph",
      "en": "To add to these documents, a template for ‘Substantial modification of clinical investigation under MDR’ is also provided.",
      "he": "בנוסף למסמכים אלה, מסופקת גם תבנית ל'שינוי מהותי של חקירה קלינית על פי ה-MDR'."
    },
    {
      "id": "intro-p4",
      "type": "paragraph",
      "en": "Insofar as possible, the modification of a clinical investigation notification form includes same data fields to the EUDAMED system in development.",
      "he": "ככל הניתן, טופס ההודעה על שינוי של חקירה קלינית כולל את אותם שדות נתונים כמו מערכת EUDAMED הנמצאת בפיתוח."
    },

    {
      "id": "sec-use",
      "type": "heading",
      "level": 1,
      "en": "Use of the template",
      "he": "שימוש בתבנית"
    },
    {
      "id": "use-p1",
      "type": "paragraph",
      "en": "This document is intended to be facilitative and its use by the Competent Authorities and sponsors is encouraged, however it is important to check with the individual Member State in which the clinical investigation is taking place or planned to be conducted as to any specific national requirements. It is foreseen that this template will be withdrawn once the EUDAMED module for clinical investigations is fully functional.",
      "he": "מסמך זה נועד לסייע, והשימוש בו על ידי הרשויות המוסמכות ונותני החסות מעודד; עם זאת, חשוב לברר מול כל מדינה חברה שבה מתבצעת או מתוכננת להתבצע החקירה הקלינית בנוגע לדרישות לאומיות ספציפיות כלשהן. צפוי כי תבנית זו תבוטל לאחר שמודול EUDAMED לחקירות קליניות יהיה כשיר במלואו."
    },

    {
      "id": "sec-annex",
      "type": "heading",
      "level": 1,
      "en": "Annex - Template",
      "he": "נספח – תבנית"
    },
    {
      "id": "annex-table",
      "type": "table",
      "header": true,
      "rows": [
        [
          { "en": "Title", "he": "כותרת" },
          { "en": "Document", "he": "מסמך" }
        ],
        [
          { "en": "Substantial modification of clinical investigation under Medical Device Regulation", "he": "שינוי מהותי של חקירה קלינית על פי תקנת המכשירים הרפואיים" },
          { "en": "Substantial modification of clinical investigation under MDR.pdf", "he": "Substantial modification of clinical investigation under MDR.pdf" }
        ]
      ]
    },
    {
      "id": "annex-note",
      "type": "note",
      "en": "The template form 'Substantial modification of clinical investigation under MDR' is provided as a separate attached document accompanying this guidance.",
      "he": "טופס התבנית 'שינוי מהותי של חקירה קלינית על פי ה-MDR' מסופק כמסמך מצורף נפרד הנלווה להנחיה זו."
    }
  ]
}
