{
  "id": "MDCG-2022-20",
  "title": {
    "en": "MDCG 2022-20 — Substantial modification of performance study under Regulation (EU) 2017/746",
    "he": "MDCG 2022-20 — שינוי מהותי במחקר ביצועים על פי תקנה (האיחוד האירופי) 2017/746"
  },
  "category": "In Vitro Diagnostic Medical Devices (IVD)",
  "publicationDate": "2022-12",
  "source": {
    "url": "https://health.ec.europa.eu/medical-devices-sector/new-regulations/guidance-mdcg-endorsed-documents-and-other-guidance_en",
    "file": "original/mdcg_2022-20_en.pdf"
  },
  "language": "he",
  "direction": "rtl",
  "translationStatus": "review",
  "glossaryVersion": "2026-06",
  "blocks": [
    {
      "id": "disclaimer-1",
      "type": "paragraph",
      "en": "This document has been endorsed by the Medical Device Coordination Group (MDCG) established by Article 103 of Regulation (EU) 2017/745. The MDCG is composed of representatives of all Member States and it is chaired by a representative of the European Commission.",
      "he": "מסמך זה אושר על ידי קבוצת תיאום המכשירים הרפואיים (MDCG) שהוקמה מכוח סעיף 103 לתקנה (האיחוד האירופי) 2017/745. ה-MDCG מורכבת מנציגים של כל המדינות החברות ובראשה עומד נציג של הנציבות האירופית."
    },
    {
      "id": "disclaimer-2",
      "type": "paragraph",
      "en": "The document is not a European Commission document and it cannot be regarded as reflecting the official position of the European Commission. Any views expressed in this document are not legally binding and only the Court of Justice of the European Union can give binding interpretations of Union law.",
      "he": "המסמך אינו מסמך של הנציבות האירופית ואין לראות בו כמשקף את העמדה הרשמית של הנציבות האירופית. כל דעה המובעת במסמך זה אינה מחייבת מבחינה משפטית, ורק בית הדין לצדק של האיחוד האירופי מוסמך לתת פרשנות מחייבת לדין האיחוד."
    },
    {
      "id": "toc",
      "type": "heading",
      "level": 1,
      "en": "Table of contents",
      "he": "תוכן העניינים"
    },
    {
      "id": "toc-list",
      "type": "list",
      "ordered": true,
      "items": [
        { "en": "ACRONYMS", "he": "ראשי תיבות" },
        { "en": "INTRODUCTION", "he": "מבוא" },
        { "en": "ANNEX – TEMPLATES", "he": "נספח – תבניות" }
      ]
    },
    {
      "id": "sec-1",
      "type": "heading",
      "level": 1,
      "number": "1",
      "en": "Acronyms",
      "he": "ראשי תיבות"
    },
    {
      "id": "sec-1-table",
      "type": "table",
      "header": true,
      "rows": [
        [
          { "en": "Acronym", "he": "ראשי תיבות" },
          { "en": "Meaning", "he": "משמעות" }
        ],
        [
          { "en": "EUDAMED", "he": "EUDAMED" },
          { "en": "European database on medical devices", "he": "מסד הנתונים האירופי בנושא מכשירים רפואיים" }
        ],
        [
          { "en": "GSPR", "he": "GSPR" },
          { "en": "General safety and performance requirements", "he": "דרישות כלליות לבטיחות וביצועים" }
        ],
        [
          { "en": "NCA", "he": "NCA" },
          { "en": "National competent authority", "he": "רשות מוסמכת לאומית" }
        ],
        [
          { "en": "PMPF", "he": "PMPF" },
          { "en": "Post-market performance follow-up", "he": "מעקב ביצועים שלאחר שיווק" }
        ],
        [
          { "en": "REC", "he": "REC" },
          { "en": "Research ethics committee", "he": "ועדת אתיקה למחקר" }
        ]
      ]
    },
    {
      "id": "sec-2",
      "type": "heading",
      "level": 1,
      "number": "2",
      "en": "Introduction",
      "he": "מבוא"
    },
    {
      "id": "sec-2-p1",
      "type": "paragraph",
      "en": "The sponsor of a performance study is required to submit an application/notification to the Member State(s) in which a performance study is to be conducted, accompanied by the documentation referred to in Chapter I of Annex XIV of Regulation (EU) 2017/746 on in vitro diagnostic medical devices (the IVDR). The application/notification must be submitted by means of the electronic system referred to in Article 69 of the IVDR.",
      "he": "נותן החסות (sponsor) של מחקר ביצועים נדרש להגיש בקשה/הודעה¹ למדינה/למדינות החברות שבהן עתיד להתבצע מחקר הביצועים, בליווי התיעוד המאוזכר בפרק I לנספח XIV לתקנה (האיחוד האירופי) 2017/746 בנושא מכשירים רפואיים לאבחנה ויטרו (ה-IVDR). את הבקשה/ההודעה יש להגיש באמצעות המערכת האלקטרונית המאוזכרת בסעיף 69 ל-IVDR."
    },
    {
      "id": "fn-1",
      "type": "note",
      "marker": "1",
      "en": "Performance study application (IVDR Art. 66(1)), PMPF study notification (IVDR Art. 70(1)).",
      "he": "בקשה למחקר ביצועים (IVDR סעיף 66(1)), הודעה על מחקר PMPF (IVDR סעיף 70(1))."
    },
    {
      "id": "sec-2-p2",
      "type": "paragraph",
      "en": "Additionally, the sponsor of a performance study is required to notify the Member State(s) in which a performance study is being or is to be conducted if it intends to introduce modifications to a performance study that are likely to have a substantial impact on the safety, health or rights of the subjects or on the robustness or reliability of the data generated by the performance study by means of the same electronic system.",
      "he": "בנוסף, נותן החסות של מחקר ביצועים נדרש להודיע² למדינה/למדינות החברות שבהן מתבצע או עתיד להתבצע מחקר הביצועים, אם בכוונתו להכניס שינויים במחקר הביצועים אשר עשויים להיות בעלי השפעה מהותית על הבטיחות, הבריאות או הזכויות של הנבדקים, או על האיתנות או המהימנות של הנתונים הנוצרים במסגרת מחקר הביצועים, באמצעות אותה מערכת אלקטרונית."
    },
    {
      "id": "fn-2",
      "type": "note",
      "marker": "2",
      "en": "Article 71 IVDR",
      "he": "סעיף 71 ל-IVDR"
    },
    {
      "id": "sec-2-p3",
      "type": "paragraph",
      "en": "In the absence of the European database on medical devices (EUDAMED), a series of performance study application/notification documents have been created to support performance study procedures with respect to the IVDR – see MDCG 2022-19.",
      "he": "בהיעדר מסד הנתונים האירופי בנושא מכשירים רפואיים (EUDAMED), נוצרה סדרה של מסמכי בקשה/הודעה למחקר ביצועים כדי לתמוך בהליכי מחקר הביצועים ביחס ל-IVDR – ראו MDCG 2022-19."
    },
    {
      "id": "sec-2-p4",
      "type": "paragraph",
      "en": "To add to these documents, a template for ‘Substantial modification of performance study under Regulation (EU) 2017/746’ is also provided.",
      "he": "כתוספת למסמכים אלה, מסופקת גם תבנית עבור ‘שינוי מהותי במחקר ביצועים על פי תקנה (האיחוד האירופי) 2017/746’."
    },
    {
      "id": "sec-2-p5",
      "type": "paragraph",
      "en": "Insofar as possible, the modification of the performance study form includes the same data fields as the EUDAMED system in development.",
      "he": "ככל הניתן, טופס השינוי במחקר הביצועים כולל את אותם שדות נתונים כמו במערכת EUDAMED הנמצאת בפיתוח."
    },
    {
      "id": "sec-2-sub-use",
      "type": "heading",
      "level": 2,
      "en": "Use of templates",
      "he": "שימוש בתבניות"
    },
    {
      "id": "sec-2-p6",
      "type": "paragraph",
      "en": "This document is intended to be facilitative and its use by the competent authorities and sponsors is encouraged, however it is important to check with the individual Member State in which the performance study is planned to be conducted for any specific national requirements. It is foreseen that this template will be withdrawn once the EUDAMED module for performance studies is fully functional.",
      "he": "מסמך זה נועד להקל על התהליך, והשימוש בו על ידי הרשויות המוסמכות ונותני החסות מומלץ; עם זאת, חשוב לבדוק מול כל מדינה חברה שבה מתוכנן להתבצע מחקר הביצועים בנוגע לכל דרישה לאומית ספציפית. צפוי שתבנית זו תבוטל לאחר שמודול EUDAMED למחקרי ביצועים יהיה כשיר לפעולה במלואו."
    },
    {
      "id": "sec-3",
      "type": "heading",
      "level": 1,
      "number": "3",
      "en": "Annex – Templates",
      "he": "נספח – תבניות"
    },
    {
      "id": "sec-3-table",
      "type": "table",
      "header": true,
      "rows": [
        [
          { "en": "Title", "he": "כותרת" },
          { "en": "Document", "he": "מסמך" }
        ],
        [
          { "en": "Substantial modification of performance study under Regulation (EU) 2017/746 on in vitro diagnostic medical devices", "he": "שינוי מהותי במחקר ביצועים על פי תקנה (האיחוד האירופי) 2017/746 בנושא מכשירים רפואיים לאבחנה ויטרו" },
          { "en": "", "he": "" }
        ]
      ]
    }
  ]
}
